{
  "id": "book_1759468067",
  "title": "Eldoria: Land of Magic",
  "description": "A magical realm where light and darkness battle for dominance",
  "entries": [
    "entry_1759468067"
  ],
  "categories": {},
  "tags": [],
  "owners": [],
  "readers": [],
  "metadata": {
    "created_by": "skogix",
    "created_at": "2025-10-03T05:07:47Z",
    "updated_at": "2025-10-03T05:07:47Z",
    "version": "1.0",
    "status": "draft"
  },
  "structure": [
    {
      "name": "Introduction",
      "description": "Overview of this lore book",
      "entries": [],
      "subsections": []
    },
    {
      "name": "World Information",
      "description": "Core world information",
      "entries": [
        "entry_1759468067"
      ],
      "subsections": []
    },
    {
      "name": "Characters",
      "description": "Important characters in Eldoria",
      "entries": [
        "entry_1759468067"
      ],
      "subsections": []
    }
  ],
  "visibility": {
    "public": false,
    "system": false
  }
}