{
  "id": "book_1763885202_623c7dd5",
  "title": "Test4",
  "description": "A magical realm",
  "entries": [],
  "categories": {},
  "tags": [],
  "owners": [],
  "readers": [],
  "metadata": {
    "created_by": "skogix",
    "created_at": "2025-11-23T08:06:42Z",
    "updated_at": "2025-11-23T08:06:42Z",
    "version": "1.0",
    "status": "draft"
  },
  "structure": [
    {
      "name": "Introduction",
      "description": "Overview of this lore book",
      "entries": [],
      "subsections": []
    }
  ],
  "visibility": {
    "public": false,
    "system": false
  }
}
