{
  "id": "book_1767097697",
  "title": "Specialized Lore for Claude-Coder Agent",
  "description": "Lore collection specifically created for claude-coder agents: always tries to do so much and thus gets almost nothing done",
  "entries": [
    "entry_1767097733",
    "entry_1767097774",
    "entry_1767097814",
    "entry_1767097847",
    "entry_1767097880",
    "entry_1767097916",
    "entry_1767097955",
    "entry_1767097999",
    "entry_1767098031",
    "entry_1767098074"
  ],
  "categories": {
    "character": [
      "entry_1767097733",
      "entry_1767097774"
    ],
    "place": [
      "entry_1767097814",
      "entry_1767097847"
    ],
    "object": [
      "entry_1767097880",
      "entry_1767097916"
    ],
    "event": [
      "entry_1767097955"
    ],
    "concept": [
      "entry_1767097999",
      "entry_1767098031",
      "entry_1767098074"
    ]
  },
  "tags": [],
  "owners": [],
  "readers": [
    "persona_1767098100"
  ],
  "metadata": {
    "created_by": "skogix",
    "created_at": "2025-12-30T12:28:17Z",
    "updated_at": "2025-12-30T12:35:00Z",
    "version": "1.0",
    "status": "draft"
  },
  "structure": [
    {
      "name": "Introduction",
      "description": "Overview of this lore book",
      "entries": [],
      "subsections": []
    }
  ],
  "visibility": {
    "public": false,
    "system": false
  }
}
