{
  "id": "book_1743791320_1d0b3ae2",
  "title": "SkogAI",
  "description": "All the documentation you could ever need",
  "entries": [
    "entry_1743791570_0322b6de",
    "entry_1743791570_3861e87e",
    "entry_1743791774_b321c05e",
    "entry_1743791774_be3bc525",
    "entry_1743791774_decd21e7",
    "entry_1743791774_c08db146",
    "entry_1743791874_0a7b74db",
    "entry_1743791874_ccde5061",
    "entry_1743791874_b35095b2",
    "entry_1743792025_499be5bc",
    "entry_1743792025_550499d3",
    "entry_1743792025_412af69f",
    "entry_1743792025_2b3fb254",
    "entry_1743792212_eda331cc",
    "entry_1743792212_d2e5df83",
    "entry_1743792213_648dc0ed",
    "entry_1743792436_7cfb8315",
    "entry_1743792436_fcf69218",
    "entry_1743792436_a06caff5",
    "entry_1743792436_6b8b088f",
    "entry_1743792580_6c61b4c1",
    "entry_1743792580_9eda1ee2",
    "entry_1743792580_31cbb01c",
    "entry_1743792752_d0b5ae3c",
    "entry_1743792752_d4acc903",
    "entry_1743792752_043d933f",
    "entry_1743793008_4adc85aa",
    "entry_1743793009_c007ab0e",
    "entry_1743793009_762315ef",
    "entry_1743793138_9797d6c3",
    "entry_1743793138_9b7e6e37",
    "entry_1743793138_65bf0190"
  ],
  "categories": {},
  "tags": [],
  "owners": [],
  "readers": [],
  "metadata": {
    "created_by": "skogix",
    "created_at": "2025-04-04T18:28:40Z",
    "updated_at": "2025-04-04T18:58:58Z",
    "version": "1.0",
    "status": "draft"
  },
  "structure": [
    {
      "name": "Introduction",
      "description": "Overview of this lore book",
      "entries": [],
      "subsections": []
    }
  ],
  "visibility": {
    "public": false,
    "system": false
  }
}
