{
  "id": "book_1767098553",
  "title": "Specialized Lore for Test-Agent Agent",
  "description": "Lore collection specifically created for test-agent agents: used to test if meta-commentary is properly stripped",
  "entries": [
    "entry_1767098569",
    "entry_1767098590",
    "entry_1767098607",
    "entry_1767098624",
    "entry_1767098644",
    "entry_1767098663",
    "entry_1767098682",
    "entry_1767098701"
  ],
  "categories": {
    "character": [
      "entry_1767098569",
      "entry_1767098590"
    ],
    "place": [
      "entry_1767098607"
    ],
    "object": [
      "entry_1767098624",
      "entry_1767098644"
    ],
    "concept": [
      "entry_1767098663",
      "entry_1767098682",
      "entry_1767098701"
    ]
  },
  "tags": [],
  "owners": [],
  "readers": [
    "persona_1767098722"
  ],
  "metadata": {
    "created_by": "skogix",
    "created_at": "2025-12-30T12:42:33Z",
    "updated_at": "2025-12-30T12:45:22Z",
    "version": "1.0",
    "status": "draft"
  },
  "structure": [
    {
      "name": "Introduction",
      "description": "Overview of this lore book",
      "entries": [],
      "subsections": []
    }
  ],
  "visibility": {
    "public": false,
    "system": false
  }
}
