{
  "id": "book_1747689302_ce2c12f2",
  "title": "Dot's Journals",
  "description": "2",
  "entries": [],
  "categories": {},
  "tags": [],
  "owners": [],
  "readers": [],
  "metadata": {
    "created_by": "skogix",
    "created_at": "2025-05-19T21:15:02Z",
    "updated_at": "2025-05-19T21:15:02Z",
    "version": "1.0",
    "status": "draft"
  },
  "structure": [
    {
      "name": "Introduction",
      "description": "Overview of this lore book",
      "entries": [],
      "subsections": []
    }
  ],
  "visibility": {
    "public": false,
    "system": false
  }
}
