{
  "id": "book_1759486042",
  "title": "Specialized Lore for Lore-Collector Agent",
  "description": "Lore collection specifically created for lore-collector agents: A lore-collector agent that helps with lore-collector tasks",
  "entries": [
    "entry_1759486161",
    "entry_1759486290",
    "entry_1759486457",
    "entry_1759486572",
    "entry_1759486713",
    "entry_1759486819",
    "entry_1759486945",
    "entry_1759487044",
    "entry_1759487135",
    "entry_1759487250",
    "entry_1759487977_cea88123",
    "entry_1759487977_93d925ef",
    "entry_1759487977_10bb61a9",
    "entry_1759487978_01d0ca98",
    "entry_1759487978_8d4a3693",
    "entry_1759487978_81a1b883",
    "entry_1759487978_797f2bbf",
    "entry_1759487978_7e8681c9",
    "entry_1759487978_3186467b",
    "entry_1759487978_cde287a5",
    "entry_1759487978_94612f33",
    "entry_1759487978_525ca992",
    "entry_1759487978_2a736ed8",
    "entry_1759487978_8f605585",
    "entry_1759487978_6d7c43da"
  ],
  "categories": {
    "character": [
      "entry_1759486161",
      "entry_1759486290"
    ],
    "place": [
      "entry_1759486457",
      "entry_1759486572"
    ],
    "object": [
      "entry_1759486713",
      "entry_1759486819"
    ],
    "event": [
      "entry_1759486945",
      "entry_1759487044"
    ],
    "concept": [
      "entry_1759487135",
      "entry_1759487250"
    ]
  },
  "tags": [],
  "owners": [],
  "readers": [],
  "metadata": {
    "created_by": "skogix",
    "created_at": "2025-10-03T10:07:22Z",
    "updated_at": "2025-10-03T10:39:38Z",
    "version": "1.0",
    "status": "draft"
  },
  "structure": [
    {
      "name": "Introduction",
      "description": "Overview of this lore book",
      "entries": [],
      "subsections": []
    }
  ],
  "visibility": {
    "public": false,
    "system": false
  }
}
