{
  "id": "book_1743791121",
  "title": "Imported Lorebook",
  "description": "Lorebook imported from external format",
  "entries": [
    "entry_1743791121",
    "entry_1743791121",
    "entry_1743791121",
    "entry_1743791121"
  ],
  "categories": {
    "custom": [
      "entry_1743791121",
      "entry_1743791121",
      "entry_1743791121",
      "entry_1743791121"
    ]
  },
  "tags": [],
  "metadata": {
    "created_by": "skogix",
    "created_at": "2025-04-04T18:25:21Z",
    "updated_at": "2025-04-04T18:25:21Z",
    "version": "1.0",
    "status": "active"
  },
  "structure": [
    {
      "name": "Imported Entries",
      "description": "Entries imported from external format",
      "entries": [
        "entry_1743791121",
        "entry_1743791121",
        "entry_1743791121",
        "entry_1743791121"
      ],
      "subsections": []
    }
  ],
  "visibility": {
    "public": true,
    "system": false
  },
  "readers": [
    "persona_1743791121"
  ]
}